{
  "meta": {
    "system_name": "Northstar Analytics",
    "version": "1.0.0",
    "based_on_design_system_version": "1.0.0",
    "status": "draft",
    "notes": "Example component catalog after first implementation pass."
  },
  "tech": {
    "html_strategy": "semantic-html",
    "css_strategy": "css-custom-properties + component classes",
    "js_strategy": "vanilla-js for progressive enhancement"
  },
  "assets": {
    "tokens_css_path": "brand/tokens.css",
    "coverage_plan_path": "components/component-coverage-plan.md",
    "sheet_inventory_path": "components/sheet-inventory.md",
    "sheet_implementation_log_path": "components/sheet-implementation-log.md",
    "sheet_implementation_batches": [
      {
        "category": "core-primitives",
        "sheet_path": "components/component-closeup-core-primitives-v1.png",
        "closeup_path": "components/component-closeup-core-primitives-v1.png",
        "source_concept_path": "pages/homepage/concept.png",
        "replica_artifact_paths": [
          "components/core-primitives.replica.html"
        ],
        "component_artifact_paths": [
          "components/core-primitives.replica.html",
          "components/css/core-primitives.components.css",
          "components/js/core-primitives.components.js"
        ],
        "catalog_snapshot_path": "components/core-primitives.component-catalog.json",
        "review_path": "components/core-primitives.review.md",
        "review_artifact_paths": [
          "components/core-primitives.review.md",
          "components/core-primitives.replica.html",
          "components/screenshots/core-primitives-1024.png"
        ],
        "screenshot_paths": [
          "components/screenshots/core-primitives-1024.png"
        ],
        "review_mode": "screenshot",
        "reusable_components_added": [
          "button",
          "text-input",
          "responsive-navigation",
          "product-card"
        ],
        "rubric_scores": {
          "coverage": 5,
          "visual_match": 4,
          "anatomy_match": 5,
          "responsive_match": 5,
          "implementation_quality": 5
        },
        "corrections_made": [
          "Adjusted card action rows to align with the component close-up and rendered screenshot."
        ],
        "simplifications": [],
        "deferred_items": [],
        "completed_before_next_sheet": true,
        "status": "implemented"
      },
      {
        "category": "data-display",
        "sheet_path": "components/component-closeup-data-display-v1.png",
        "closeup_path": "components/component-closeup-data-display-v1.png",
        "source_concept_path": "pages/homepage/concept.png",
        "replica_artifact_paths": [
          "components/data-display.replica.html"
        ],
        "component_artifact_paths": [
          "components/data-display.replica.html",
          "components/css/data-display.components.css",
          "components/js/data-display.components.js"
        ],
        "catalog_snapshot_path": "components/data-display.component-catalog.json",
        "review_path": "components/data-display.review.md",
        "review_artifact_paths": [
          "components/data-display.review.md",
          "components/data-display.replica.html",
          "components/screenshots/data-display-1024.png"
        ],
        "screenshot_paths": [
          "components/screenshots/data-display-1024.png"
        ],
        "review_mode": "screenshot",
        "reusable_components_added": [
          "data-table",
          "status-badge"
        ],
        "rubric_scores": {
          "coverage": 4,
          "visual_match": 4,
          "anatomy_match": 4,
          "responsive_match": 5,
          "implementation_quality": 5
        },
        "corrections_made": [
          "Increased icon contrast in active and disabled states after screenshot review."
        ],
        "simplifications": [],
        "deferred_items": [],
        "completed_before_next_sheet": true,
        "status": "implemented"
      }
    ],
    "replica_gallery_html_path": "components/replica-gallery.html",
    "component_reference_html_path": "components/replica-gallery.html",
    "gallery_screenshot_paths": [
      "components/replica-gallery.png"
    ],
    "component_sheet_path": "components/component-closeup-core-primitives-v1.png",
    "component_closeup_path": "components/component-closeup-core-primitives-v1.png",
    "component_sheet_paths": [
      "components/component-closeup-core-primitives-v1.png",
      "components/component-closeup-data-display-v1.png"
    ],
    "component_closeup_paths": [
      "components/component-closeup-core-primitives-v1.png",
      "components/component-closeup-data-display-v1.png"
    ],
    "nav_open_screenshot_paths": [
      "components/screenshots/responsive-nav-open-390.png",
      "components/screenshots/responsive-nav-open-768.png"
    ],
    "gallery_review_artifact_paths": [
      "components/replica-gallery.html",
      "components/replica-gallery.png",
      "components/component-gallery-check.json",
      "components/page-consumption-smoke.json",
      "components/artifact-validation.json"
    ],
    "replica_fidelity_review": {
      "reference_sheet_paths": [
        "components/component-closeup-core-primitives-v1.png",
        "components/component-closeup-data-display-v1.png"
      ],
      "gallery_screenshot_paths": [
        "components/replica-gallery.png",
        "components/screenshots/responsive-390.png",
        "components/screenshots/responsive-1024.png"
      ],
      "gallery_review_artifact_paths": [
        "components/replica-gallery.html",
        "components/replica-gallery.png"
      ],
      "review_mode": "screenshot",
      "rubric_scores": {
        "coverage": 5,
        "visual_match": 4,
        "anatomy_match": 5,
        "responsive_match": 5,
        "implementation_quality": 5
      },
      "coverage_summary": "The componentized replica/reference renders the component families, variants, states, responsive navigation, and repeated-card anatomy from the approved focused visual component close-ups.",
      "failed_categories": [],
      "corrections_made": [
        "Adjusted card action rows to align with the component close-up and rendered screenshot.",
        "Increased icon contrast in active and disabled states after screenshot review."
      ],
      "simplifications": [],
      "status": "matches"
    },
    "sheet_fidelity_review": {
      "reference_sheet_paths": [
        "components/component-closeup-core-primitives-v1.png",
        "components/component-closeup-data-display-v1.png"
      ],
      "review_mode": "screenshot",
      "coverage_summary": "Compatibility summary for older Maquette consumers; see replica_fidelity_review for the detailed rubric.",
      "simplifications": [],
      "status": "matches"
    },
    "reusable_component_review": {
      "status": "ready",
      "api_summary": "Reusable classes expose variants, sizes, states, slots, JS behavior, and accessibility hooks for page implementation.",
      "ready_for_pages": true,
      "usage_examples_path": "components/replica-gallery.html",
      "gaps": []
    },
    "review_notes_path": "components/approved.md"
  },
  "components": [
    {
      "name": "button",
      "source_required_component": "button",
      "files": [
        "components/css/components.css",
        "components/js/components.js",
        "components/replica-gallery.html"
      ],
      "selectors": [
        ".btn",
        ".btn--primary",
        ".btn--secondary",
        ".btn--ghost",
        ".btn--danger",
        ".btn--link"
      ],
      "implemented_variants": [
        "primary",
        "secondary",
        "ghost",
        "danger",
        "link"
      ],
      "implemented_sizes": [
        "sm",
        "md",
        "lg"
      ],
      "implemented_states": [
        "default",
        "hover",
        "focus-visible",
        "active",
        "disabled",
        "loading"
      ],
      "api": {
        "slots": [
          "icon-start",
          "label",
          "icon-end"
        ],
        "required_attributes": [
          "type for native button usage",
          "aria-busy when loading"
        ],
        "js_behavior": "No JS required except optional loading-state toggles.",
        "usage_examples": [
          "<button class=\"btn btn--primary\">Save route</button>",
          "<button class=\"btn btn--secondary\"><span class=\"icon\"></span>Filter</button>"
        ]
      },
      "accessibility_notes": [
        "Visible focus ring",
        "Minimum 40px touch target on md and lg"
      ],
      "visual_review": {
        "reference_image_paths": [
          "brand/brand-board-v1.png",
          "components/component-closeup-core-primitives-v1.png"
        ],
        "latest_screenshot_path": "components/replica-gallery.png",
        "similarity_notes": "Button density and radius match the approved board. Ghost hover treatment is intentionally subtle."
      },
      "status": "reviewed"
    },
    {
      "name": "text-input",
      "source_required_component": "text-input",
      "files": [
        "components/css/components.css",
        "components/js/components.js",
        "components/replica-gallery.html"
      ],
      "selectors": [
        ".field",
        ".field__input",
        ".field__label",
        ".field--error",
        ".field--readonly"
      ],
      "implemented_variants": [
        "default",
        "filled",
        "error"
      ],
      "implemented_sizes": [
        "md",
        "lg"
      ],
      "implemented_states": [
        "default",
        "hover",
        "focus-visible",
        "disabled",
        "error",
        "readonly"
      ],
      "api": {
        "slots": [
          "label",
          "control",
          "help-text",
          "error-text"
        ],
        "required_attributes": [
          "for/id pairing",